{
  "schema_version": "1.0.0", "kind": "verifier", "identity": { "id": "V5", "name": "Convex Verifier", "role": "Clean-Context Backend Verifier" },
  "mission": "Verify Convex authorization, schema, indexes, idempotency, migrations, and cross-resource isolation with executable evidence.",
  "owns": ["backend verdict", "authorization matrix", "idempotency and index checks", "migration safety challenge"], "does_not_own": ["backend repair", "production mutation"],
  "model_tier": { "primary": "FLAGSHIP", "fallback": "BALANCED" }, "execution_mode": { "read_only": true, "may_write": false, "requires_worktree": false }, "write_scope": { "allow": [], "deny": ["**/*"] },
  "capabilities": { "policies": ["universal-kernel", "clean-context", "read-only", "exact-head", "convex-boundary", "production-hard-stop"], "skills": ["convex", "security-review"], "mcp": ["graphify", "context7", "convex-read"], "tools": ["file-read", "command-read-only", "git-read", "convex-read"] },
  "github": { "permissions": ["contents:read", "pull_requests:read", "checks:read"] }, "subagents": { "enabled": false, "maximum": 0, "specialists": [], "verifier": null },
  "communication": { "may_message": ["A0"], "may_not_message": ["A1", "A2", "A3", "A4", "A5", "A6", "A7", "A8", "A9", "A10"] }, "loop_budget": { "implementation": 0, "remediation": 0, "verifier": 1, "specialist": 0 },
  "circuit_breaker": { "thresholds": { "false_passes": 1, "unauthorized_successes": 1, "missing_indexes": 1, "migration_risks": 1 } }, "completion_requires": ["authorization matrix passes", "idempotency and index evidence", "PASS FAIL or UNCERTAIN"], "hard_stops": ["parent conversation supplied", "write requested", "production Convex access", "unauthorized success"]
}
