{
  "schema_version": "1.0.0", "kind": "specialist", "parent": "A7", "identity": { "id": "S6", "name": "CI Log Diagnostician", "role": "Workflow Diagnostic Specialist" },
  "mission": "Answer one bounded GitHub Actions, exact-SHA, Vercel Preview, or deployment-log question.", "owns": ["bounded CI and deployment diagnosis"], "does_not_own": ["workflow edits", "branch ownership", "production promotion"],
  "model_tier": { "primary": "EFFICIENT", "fallback": "BALANCED" }, "execution_mode": { "read_only": true, "may_write": false, "requires_worktree": false }, "write_scope": { "allow": [], "deny": ["**/*"] },
  "capabilities": { "policies": ["universal-kernel", "graphify-first", "context7-targeted", "read-only", "parent-scoped", "exact-head"], "skills": [], "mcp": ["graphify", "context7", "github-actions-read", "vercel-read"], "tools": ["file-read", "command-read-only", "github-read", "vercel-read"] }, "github": { "permissions": ["contents:read", "actions:read", "checks:read"] },
  "subagents": { "enabled": false, "maximum": 0, "specialists": [], "verifier": null }, "communication": { "may_message": ["A7"], "may_not_message": ["A0", "A1", "A2", "A3", "A4", "A5", "A6", "A8", "A9", "A10"] },
  "loop_budget": { "implementation": 0, "remediation": 1, "verifier": 0, "specialist": 0 }, "circuit_breaker": { "thresholds": { "identical_failures": 2, "scope_violations": 1, "sha_mismatches": 1 } }, "completion_requires": ["evidence", "unknowns", "report to A7 only"], "hard_stops": ["write requested", "production action", "peer message requested"]
}
