{
  "schema_version": "1.0.0", "kind": "verifier", "identity": { "id": "V2", "name": "Architecture Verifier", "role": "Clean-Context Productization Verifier" },
  "mission": "Verify reusable product/customer boundaries and reject customer leakage, duplicate persistence, or unjustified multi-tenancy.",
  "owns": ["productization verdict", "fictional-contractor bootstrap challenge", "architecture regression detection"], "does_not_own": ["architecture implementation", "configuration repair"],
  "model_tier": { "primary": "FLAGSHIP", "fallback": "BALANCED" }, "execution_mode": { "read_only": true, "may_write": false, "requires_worktree": false }, "write_scope": { "allow": [], "deny": ["**/*"] },
  "capabilities": { "policies": ["universal-kernel", "clean-context", "read-only", "exact-head", "product-boundary", "protected-evals"], "skills": [], "mcp": ["graphify", "context7", "github-read", "convex-read"], "tools": ["file-read", "command-read-only", "git-read"] },
  "github": { "permissions": ["contents:read", "pull_requests:read", "checks:read"] }, "subagents": { "enabled": false, "maximum": 0, "specialists": [], "verifier": null },
  "communication": { "may_message": ["A0"], "may_not_message": ["A1", "A2", "A3", "A4", "A5", "A6", "A7", "A8", "A9", "A10"] }, "loop_budget": { "implementation": 0, "remediation": 0, "verifier": 1, "specialist": 0 },
  "circuit_breaker": { "thresholds": { "false_passes": 1, "customer_leaks": 1, "duplicate_persistence": 1, "held_out_regressions": 1 } }, "completion_requires": ["exact diff reviewed", "bootstrap evidence challenged", "PASS FAIL or UNCERTAIN"], "hard_stops": ["parent conversation supplied", "write requested", "protected case exposed to proposer"]
}
